{
  "id": "ape",
  "name": "Grand singe",
  "source": "srd",
  "size": "medium",
  "creatureType": "bête",
  "alignment": "sans alignement",
  "abilities": {
    "strength": 16,
    "dexterity": 14,
    "constitution": 14,
    "intelligence": 6,
    "wisdom": 12,
    "charisma": 7
  },
  "armorClass": 12,
  "hitPoints": 19,
  "hitDice": "3d8+6",
  "speed": {
    "walk": 9,
    "climb": 9
  },
  "challengeRating": 0.5,
  "senses": [
    "Perception passive 13"
  ],
  "skills": {
    "athletics": 5,
    "perception": 3
  },
  "actions": [
    {
      "name": "Attaques multiples",
      "text": "Le grand singe réalise deux attaques avec ses poings."
    },
    {
      "name": "Poing",
      "text": "Attaque au corps à corps avec une arme : +5 au toucher, allonge 1,50 m, une cible. Touché : 6 (1d6 + 3) dégâts contondants.",
      "attackBonus": 5,
      "reach": 1.5,
      "damage": "1d6+3",
      "damageType": "bludgeoning"
    },
    {
      "name": "Rocher",
      "text": "Attaque à distance avec une arme : +5 au toucher, portée 7,50/15 m, une cible. Touché : 6 (1d6 + 3) dégâts contondants.",
      "attackBonus": 5,
      "damage": "1d6+3",
      "damageType": "bludgeoning"
    }
  ]
}
