{
  "id": "giant-spider",
  "name": "Araignée géante",
  "source": "srd",
  "size": "large",
  "creatureType": "bête",
  "alignment": "sans alignement",
  "abilities": {
    "strength": 14,
    "dexterity": 16,
    "constitution": 12,
    "intelligence": 2,
    "wisdom": 11,
    "charisma": 4
  },
  "armorClass": 14,
  "hitPoints": 26,
  "hitDice": "4d10+4",
  "speed": {
    "walk": 9,
    "climb": 9
  },
  "challengeRating": 1,
  "senses": [
    "vision aveugle 3 m",
    "vision dans le noir 18 m",
    "Perception passive 10"
  ],
  "skills": {
    "stealth": 7
  },
  "traits": [
    {
      "name": "Déplacement sur la toile",
      "text": "L'araignée ignore les restrictions de mouvement causées par une toile d'araignée."
    },
    {
      "name": "Pattes d'araignée",
      "text": "L'araignée peut escalader des surfaces difficiles et être au plafond la tête en bas sans avoir besoin d'effectuer un jet de caractéristique."
    },
    {
      "name": "Sens de la toile",
      "text": "Lorsqu'elle est en contact avec une toile, l'araignée connait l'emplacement exact de toutes les créatures qui sont en contact avec cette toile."
    }
  ],
  "actions": [
    {
      "name": "Morsure",
      "text": "Attaque au corps à corps avec une arme : +5 au toucher, allonge 1,50 m, une créature. Touché : 7 (1d8 + 3) dégâts perforants, et la cible doit réaliser un jet de sauvegarde de Constitution DD 11, subissant 9 (2d8) dégâts de poison en cas d'échec, ou la moitié de ces dégâts en cas de réussite. Si le poison réduit les points de vie de la cible à 0, celle-ci est stable mais empoisonnée durant 1 heure, même si elle récupère des points de vie par la suite, et paralysée tant qu'elle est empoisonnée de cette manière.",
      "attackBonus": 5,
      "reach": 1.5,
      "damage": "1d8+3",
      "damageType": "piercing"
    },
    {
      "name": "Toile d'araignée (Recharge 5-6)",
      "text": "Attaque à distance avec une arme : +5 au toucher, portée 9/18 m, une créature. Touché : la cible est entravée par la toile. Par une action, la cible entravée peut effectuer un jet de Force DD 12, déchirant la toile en cas de réussite. La toile peut aussi être attaquée et détruite (CA 10 ; pv 5 ; vulnérabilité aux dégâts de feu ; immunités aux dégâts contondants, de poison et psychiques).",
      "attackBonus": 5
    }
  ],
  "description": "Pour piéger sa proie, une araignée géante tisse des toiles élaborées ou jette des brins de toile collants de son abdomen. Les araignées géantes vivent généralement sous terre, établissant leurs repaires au plafond ou dans des crevasses obscures. Ces endroits sont souvent ornés de cocons qui retiennent d'anciennes victimes."
}
