{
  "id": "sprite",
  "name": "Esprit follet",
  "source": "srd",
  "size": "tiny",
  "creatureType": "fée",
  "alignment": "neutre bon",
  "abilities": {
    "strength": 3,
    "dexterity": 18,
    "constitution": 10,
    "intelligence": 14,
    "wisdom": 13,
    "charisma": 11
  },
  "armorClass": 15,
  "hitPoints": 2,
  "hitDice": "1d4",
  "speed": {
    "walk": 3,
    "fly": 12
  },
  "challengeRating": 0.25,
  "senses": [
    "Perception passive 13"
  ],
  "skills": {
    "stealth": 8,
    "perception": 3
  },
  "languages": [
    "common",
    "elvish",
    "sylvan"
  ],
  "actions": [
    {
      "name": "Épée longue",
      "text": "Attaque au corps à corps avec une arme : +2 au toucher, allonge 1,50 m, une cible. Touché : 1 dégât tranchant.",
      "attackBonus": 2,
      "reach": 1.5,
      "damage": "1",
      "damageType": "slashing"
    },
    {
      "name": "Arc court",
      "text": "Attaque à distance avec une arme : +6 au toucher, portée 12/48 m, une cible. Touché : 1 dégât perforant, et la cible doit réussir un jet de sauvegarde de Constitution DD 10 ou être empoisonnée pendant 1 minute. Si le jet de sauvegarde échoue de 5 ou plus, la cible empoisonnée tombe inconsciente pour la durée de l'empoisonnement, ou jusqu'à ce qu'elle subisse des dégâts, ou jusqu'à ce qu'une autre créature utilise son action pour la secouer et la réveiller.",
      "attackBonus": 6,
      "damage": "1",
      "damageType": "piercing"
    },
    {
      "name": "Perception du for intérieur",
      "text": "L'esprit follet touche une créature et en apprend magiquement l'état émotionnel. Si la cible échoue à un jet de sauvegarde de Charisme DD 10, alors l'esprit follet connaît également l'alignement de la créature. Les célestes, les fiélons, et les morts-vivants échouent automatiquement leur jet de sauvegarde."
    },
    {
      "name": "Invisibilité",
      "text": "L'esprit follet devient invisible par magie jusqu'à ce qu'il attaque, lance un sort, ou que sa concentration se termine (comme s'il se concentrait sur un sort). Tout l'équipement que l'esprit follet porte ou transporte est également invisible."
    }
  ]
}
