{
  "id": "giant-ape",
  "name": "Singe géant",
  "source": "srd",
  "size": "huge",
  "creatureType": "bête",
  "alignment": "sans alignement",
  "abilities": {
    "strength": 23,
    "dexterity": 14,
    "constitution": 18,
    "intelligence": 7,
    "wisdom": 12,
    "charisma": 7
  },
  "armorClass": 12,
  "hitPoints": 157,
  "hitDice": "15d12+60",
  "speed": {
    "walk": 12,
    "climb": 12
  },
  "challengeRating": 7,
  "senses": [
    "Perception passive 14"
  ],
  "skills": {
    "athletics": 9,
    "perception": 4
  },
  "actions": [
    {
      "name": "Attaques multiples",
      "text": "Le singe réalise deux attaques avec ses poings."
    },
    {
      "name": "Poing",
      "text": "Attaque au corps à corps avec une arme : +9 au toucher, allonge 3 m, une cible. Touché : 22 (3d10 + 6) dégâts contondants.",
      "attackBonus": 9,
      "reach": 3,
      "damage": "3d10+6",
      "damageType": "bludgeoning"
    },
    {
      "name": "Rocher",
      "text": "Attaque à distance avec une arme : +9 au toucher, portée 15/30 m, une cible. Touché : 30 (7d6 + 6) dégâts contondants.",
      "attackBonus": 9,
      "damage": "7d6+6",
      "damageType": "bludgeoning"
    }
  ]
}
